Participant ID,Name of CCASS Participant(* for Consenting Investor Participants ),Address,Shareholding,% of the total numberof Issued Shares/Warrants/Units


C00019,THE HONGKONG AND SHANGHAI BANKING,HSBC WEALTH BUSINESS SERVICES 8/F TOWER 2 & 3 HSBC CENTRE 1 SHAM MONG ROAD KOWLOON,"825,397,011",21.39%
C00039,STANDARD CHARTERED BANK (HONG KONG) LTD,SECURITIES SERVICES 15/F STANDARD CHARTERED TOWER 388 KWUN TONG ROAD KWUN TONG KOWLOON,"555,438,334",14.39%
C00100,"JPMORGAN CHASE BANK, NATIONAL",48/F ONE ISLAND EAST 18 WESTLANDS ROAD QUARRY BAY HONG KONG,"366,690,584",9.50%
C00010,CITIBANK N.A.,9/F CITI TOWER ONE BAY EAST 83 HOI BUN ROAD KWUN TONG KOWLOON,"282,395,652",7.32%
C00074,DEUTSCHE BANK AG,51/F-66/F INTERNATIONAL COMMERCE CENTRE 1 AUSTIN ROAD WEST KOWLOON,"57,880,118",1.50%
B01161,UBS SECURITIES HONG KONG LTD,42/F ONE EXCHANGE SQUARE 8 CONNAUGHT PLACE CENTRAL HONG KONG,"46,008,771",1.19%
C00033,BANK OF CHINA (HONG KONG) LTD,11/F BANK OF CHINA CENTRE OLYMPIAN CITY 11 HOI FAI ROAD WEST KOWLOON,"43,620,789",1.13%
C00093,BNP PARIBAS SECURITIES SERVICES,21/F PCCW TOWER TAIKOO PLACE 979 KING'S ROAD QUARRY BAY HONG KONG,"39,227,130",1.01%
B01284,HANG SENG SECURITIES LTD,16/F HANG SENG 113 113 ARGYLE STREET MONGKOK KOWLOON,"19,400,644",0.50%
B01451,GOLDMAN SACHS (ASIA) SECURITIES LTD,68TH FLOOR CHEUNG KONG CENTER 2 QUEEN'S ROAD CENTRAL HONG KONG,"18,295,420",0.47%
C00018,HANG SENG BANK LTD,16/F HANG SENG 113 113 ARGYLE STREET MONGKOK KOWLOON,"16,875,234",0.43%
B01274,MORGAN STANLEY HONG KONG SECURITIES LTD,46/F INTERNATIONAL COMMERCE CENTRE 1 AUSTIN ROAD WEST KOWLOON,"14,462,257",0.37%
C00003,THE BANK OF EAST ASIA LTD,35/F BEA TOWER MILLENNIUM CITY 5 418 KWUN TONG ROAD KWUN TONG KOWLOON,"13,254,815",0.34%
C00042,WING LUNG BANK LTD,RM 1207-1209 12/F WING LUNG BANK CENTRE 636 NATHAN ROAD KOWLOON,"11,882,665",0.30%
A00003,CHINA SECURITIES DEPOSITORY AND CLEARING,17 TAIPING QIAO STREET XICHENG DISTRICT BEIJING CHINA,"11,430,506",0.29%
B01130,BOCI SECURITIES LTD,22/F GRAND MILLENNIUM PLAZA 181 QUEEN'S ROAD CENTRAL HONG KONG,"9,893,712",0.25%
C00037,SHANGHAI COMMERCIAL BANK LTD,C/O SECURITIES PROCESSING CENTRE LEVEL 23 TOWER 2 KOWLOON COMMERCE CENTRE 51 KWAI CHEONG ROAD KWAI CHUNG NEW TERRITORIES,"9,260,851",0.24%
C00041,OCBC WING HANG BANK LTD,UNIT 1702 17/F EASTERN CENTRAL PLAZA 3 YIU HING ROAD SHAU KEI WAN HONG KONG,"9,100,340",0.23%
B01089,HSBC BROKING SECURITIES (HONG KONG) LTD,LEVEL 25 HSBC MAIN BUILDING 1 QUEEN'S ROAD CENTRAL HONG KONG,"9,076,529",0.23%
B01762,DBS VICKERS (HONG KONG) LTD,18/F MAN YEE BUILDING 68 DES VOEUX ROAD CENTRAL HONG KONG,"7,208,402",0.18%
B01491,CREDIT SUISSE SECURITIES (HONG KONG) LTD,LEVEL 88 INTERNATIONAL COMMERCE CENTRE 1 AUSTIN ROAD WEST KOWLOON,"6,975,695",0.18%
C00015,DBS BANK (HONG KONG) LTD,11/F MILLENNIUM CITY 6 392 KWUN TONG ROAD KWUN TONG KOWLOON,"6,414,574",0.16%
C00002,BANK OF COMMUNICATIONS TRUSTEE LTD,15/F BANK OF COMMUNICATIONS TOWER 231-235 GLOUCESTER ROAD WANCHAI HONG KONG,"5,754,505",0.14%
B01118,EAST ASIA SECURITIES CO LTD,C/O BEA SETTLEMENT OPERATIONS DEPT-IOS 35/F BEA TOWER MILLENNIUM CITY 5 418 KWUN TONG ROAD KOWLOON,"5,599,492",0.14%
B01353,UOB KAY HIAN (HONG KONG) LTD,RM 1501 AON CHINA BUILDING 29 QUEEN'S ROAD CENTRAL HONG KONG,"5,454,338",0.14%
B01133,RBC INVESTMENT SERVICES (ASIA) LTD,RM 1701 CHEUNG KONG CENTER 2 QUEEN'S ROAD CENTRAL HONG KONG,"4,635,270",0.12%
B01727,ICBC (ASIA) SECURITIES LTD,LEVEL 16 TOWER 1 MILLENNIUM CITY 1 388 KWUN TONG ROAD KWUN TONG KOWLOON,"4,264,093",0.11%
C00028,NANYANG COMMERCIAL BANK LTD,11/F BANK OF CHINA CENTRE OLYMPIAN CITY 11 HOI FAI ROAD WEST KOWLOON,"4,239,746",0.10%
B01086,SUN HUNG KAI INVESTMENT SERVICES LTD,42/F LEE GARDEN ONE 33 HYSAN AVENUE CAUSEWAY BAY HONG KONG,"4,126,394",0.10%
C00036,CHINA CONSTRUCTION BANK (ASIA),20/F CCB CENTRE 18 WANG CHIU ROAD KOWLOON BAY KOWLOON,"3,542,210",0.09%
B01224,MERRILL LYNCH FAR EAST LTD,C/O BANK OF AMERICA MERRILL LYNCH 38/F CHEUNG KONG CENTER 2 QUEEN'S ROAD CENTRAL CENTRAL HONG KONG,"3,426,256",0.08%
C00058,CHINA CITIC BANK INTERNATIONAL LTD,18/F DEVON HOUSE TAIKOO PLACE 979 KING'S ROAD QUARRY BAY HONG KONG,"3,324,533",0.08%
B01121,SG SECURITIES (HK) LTD,38/F 3 PACIFIC PLACE 1 QUEEN'S ROAD EAST HONG KONG,"3,104,335",0.08%
B01695,DAH SING SECURITIES LTD,RM 2403 24/F EVERBRIGHT CENTRE 108 GLOUCESTER ROAD WANCHAI HONG KONG,"2,918,528",0.07%
B01183,CHONG HING SECURITIES LTD,2/F CHONG HING BANK CENTRE 24 DES VOEUX ROAD CENTRAL HONG KONG,"2,550,223",0.06%
B01668,BRIGHT SMART SECURITIES INTERNATIONAL,10/F WING ON HOUSE 71 DES VOEUX ROAD CENTRAL CENTRAL HONG KONG,"2,476,581",0.06%
C00048,CHIYU BANKING CORPORATION LTD,11/F BANK OF CHINA CENTRE OLYMPIAN CITY 11 HOI FAI ROAD WEST KOWLOON,"2,227,319",0.05%
B01345,PHILLIP SECURITIES (HONG KONG) LTD,11/F UNITED CENTRE 95 QUEENSWAY HONG KONG,"1,867,152",0.04%
B01590,INTERACTIVE BROKERS HONG KONG LTD,SUITE 1512 TWO PACIFIC PLACE 88 QUEENSWAY HONG KONG,"1,864,224",0.04%
C00016,DBS BANK LTD,11/F MILLENNIUM CITY 6 392 KWUN TONG ROAD KWUN TONG KOWLOON,"1,837,700",0.04%
C00102,MACQUARIE BANK LTD,LEVEL 18 ONE INTERNATIONAL FINANCE CENTRE 1 HARBOUR VIEW STREET CENTRAL HONG KONG,"1,827,977",0.04%
B01143,HAITONG INTERNATIONAL SECURITIES CO LTD,22/F LI PO CHUN CHAMBERS 189 DES VOEUX ROAD CENTRAL HONG KONG,"1,626,551",0.04%
B01129,WOCOM SECURITIES LTD,RM 1002 WING ON CENTRE 111 CONNAUGHT ROAD CENTRAL HONG KONG,"1,624,048",0.04%
C00040,INDUSTRIAL AND COMMERCIAL BANK OF CHINA,LEVEL 16 TOWER 1 MILLENNIUM CITY 1 388 KWUN TONG ROAD KWUN TONG KOWLOON,"1,420,318",0.03%
B01511,TAT LEE SECURITIES CO LTD,RM 1801-1806 PRESIDENT COMMERCIAL CENTRE 608 NATHAN ROAD MONGKOK KOWLOON,"1,344,527",0.03%
B01610,KGI ASIA LTD,41/F CENTRAL PLAZA 18 HARBOUR ROAD WANCHAI HONG KONG,"1,341,452",0.03%
B01272,FB SECURITIES (HONG KONG) LTD,19/F GREENWICH CENTRE 260 KING'S ROAD NORTH POINT HONG KONG,"1,162,513",0.03%
B01842,BOCOM INTERNATIONAL SECURITIES LTD,11/F MAN YEE BUILDING 68 DES VOEUX ROAD CENTRAL HONG KONG,"1,134,355",0.02%
B01497,SINOPAC SECURITIES (ASIA) LTD,21/F ONE PEKING 1 PEKING ROAD TSIMSHATSUI KOWLOON,"1,024,823",0.02%
B01584,CHIEF SECURITIES LTD,11/F FWD FINANCIAL CENTRE 308 DES VOEUX ROAD CENTRAL HONG KONG,"985,625",0.02%
B01800,SUN CAPITAL SECURITIES LTD,16/F HARBOUR COMMERCIAL BUILDING 122-124 CONNAUGHT ROAD CENTRAL HONG KONG,"922,668",0.02%
B01500,D.J. SECURITIES LTD,13/F D. J. BUILDING 173 HOI BUN ROAD KWUN TONG KOWLOON,"904,496",0.02%
C00095,EFG BANK AG,18/F INTERNATIONAL COMMERCE CENTRE 1 AUSTIN ROAD WEST KOWLOON,"868,409",0.02%
B01582,THING ON SECURITIES LTD,17/F BANK OF EAST ASIA HARBOUR VIEW CENTRE 56 GLOUCESTER ROAD WANCHAI HONG KONG,"815,000",0.02%
C00012,DAH SING BANK LTD,RM 2403 24/F EVERBRIGHT CENTRE 108 GLOUCESTER ROAD WANCHAI HONG KONG,"814,564",0.02%
B01623,TAI FUNG KUENTAI SECURITIES CO LTD,RM 3310 33/F BANK OF AMERICA TOWER 12 HARCOURT ROAD CENTRAL HONG KONG,"778,224",0.02%
C00083,BANK CONSORTIUM TRUST CO LTD,18/F COSCO TOWER 183 QUEEN'S ROAD CENTRAL HONG KONG,"760,846",0.01%
B01209,MASON SECURITIES LTD,PORTION 1 12/F THE CENTER 99 QUEEN'S ROAD CENTRAL HONG KONG,"740,689",0.01%
B01338,EMPEROR SECURITIES LTD,23/F-24/F EMPEROR GROUP CENTRE 288 HENNESSY ROAD WANCHAI HONG KONG,"716,694",0.01%
B01148,CHINA MERCHANTS SECURITIES (HK) CO LTD,48/F ONE EXCHANGE SQUARE 8 CONNAUGHT ROAD CENTRAL HONG KONG,"698,201",0.01%
B01376,PUBLIC SECURITIES LTD,RM 1101-1103 WING ON HOUSE 71 DES VOEUX ROAD CENTRAL HONG KONG,"689,348",0.01%
B01905,ESSENCE INTERNATIONAL SECURITIES,39/F ONE EXCHANGE SQUARE CENTRAL HONG KONG,"672,976",0.01%
B01649,CINDA INTERNATIONAL SECURITIES LTD,45TH FLOOR COSCO TOWER 183 QUEEN'S ROAD CENTRAL HONG KONG,"644,838",0.01%
B01282,CHELSEA SECURITIES LTD,"RM 702, 704-705 YU YUET LAI BUILDING 43-55 WYNDHAM STREET CENTRAL HONG KONG","593,384",0.01%
B01264,KIM ENG SECURITIES (HONG KONG) LTD,28/F LEE GARDEN THREE 1 SUNNING ROAD CAUSEWAY BAY HONG KONG,"552,992",0.01%
B01169,PUBLIC FINANCIAL SECURITIES LTD,10/F PUBLIC BANK CENTRE 120 DES VOEUX ROAD CENTRAL HONG KONG,"548,032",0.01%
B01119,CELESTIAL SECURITIES LTD,9/F LOW BLOCK GRAND MILLENNIUM PLAZA 181 QUEEN'S ROAD CENTRAL HONG KONG,"531,431",0.01%
B01362,JOSPA INVESTMENT CO LTD,303-5 YUE SHING COMMERCIAL BLDG 15-16 QUEEN VICTORIA STREET CENTRAL HONG KONG,"516,420",0.01%
B01228,CITIC SECURITIES BROKERAGE (HK) LTD,26/F CITIC TOWER 1 TIM MEI AVENUE CENTRAL HONG KONG,"491,294",0.01%
B01494,AUDREY CHOW SECURITIES LTD,6/F GRAND BUILDING 15-18 CONNAUGHT ROAD CENTRAL HONG KONG,"468,809",0.01%
B01275,SANFULL SECURITIES LTD,RM 2001-2006 COSCO TOWER 183 QUEEN'S ROAD CENTRAL HONG KONG,"462,515",0.01%
B01137,CHOW SANG SANG SECURITIES LTD,RM 1704-1710 KORNHILL PLAZA-OFFICE TOWER 1 KORNHILL ROAD QUARRY BAY HONG KONG,"454,916",0.01%
B01246,ROCTEC SECURITIES CO LTD,RM 2406 24/F GRAND MILLENNIUM PLAZA 181 QUEEN'S ROAD CENTRAL HONG KONG,"432,757",0.01%
B01673,FULBRIGHT SECURITIES LTD,33/F COSCO TOWER GRAND MILLENNIUM PLAZA 183 QUEEN'S ROAD CENTRAL HONG KONG,"431,695",0.01%
B01289,SOUTH CHINA SECURITIES LTD,28/F BANK OF CHINA TOWER 1 GARDEN RD CENTRAL HONG KONG,"430,850",0.01%
B01355,CHINA EVERBRIGHT SECURITIES (HK) LTD,24/F LEE GARDEN ONE 33 HYSAN AVENUE CAUSEWAY BAY HONG KONG,"406,992",0.01%
B01392,TAIFAIR SECURITIES LTD,RM 701 DINA HOUSE RUTTONJEE CENTRE 11 DUDDELL STREET CENTRAL HONG KONG,"405,300",0.01%
A00004,CHINA SECURITIES DEPOSITORY AND CLEARING,17 TAIPING QIAO STREET XICHENG DISTRICT BEIJING CHINA,"404,000",0.01%
B01413,CORE PACIFIC - YAMAICHI INTERNATIONAL,11/F CHINA RESOURCES BUILDING 26 HARBOUR ROAD WANCHAI HONG KONG,"378,180",0.00%
B01423,PRUDENTIAL BROKERAGE LTD,RM 901-904 WORLD WIDE HOUSE 19 DES VOEUX ROAD CENTRAL HONG KONG,"376,128",0.00%
B01347,CGS-CIMB SECURITIES (HONG KONG) LTD,25/F GLOUCESTER TOWER THE LANDMARK 15 QUEEN'S ROAD CENTRAL HONG KONG,"356,404",0.00%
B01813,CCB INTERNATIONAL SECURITIES LTD,12/F CCB TOWER 3 CONNAUGHT ROAD CENTRAL CENTRAL HONG KONG,"353,492",0.00%
B01115,SHENWAN HONGYUAN SECURITIES (H.K.) LTD,LEVEL 19 28 HENNESSY ROAD HONG KONG,"345,631",0.00%
B01818,I-ACCESS INVESTORS LTD,SUITES 3208-3211 32/F TOWER TWO TIMES SQUARE 1 MATHESON STREET CAUSEWAY BAY HONG KONG,"342,522",0.00%
B01801,KIN FUNG STOCK CO LTD,RM 2105 21/F MELBOURNE PLAZA 33 QUEEN'S ROAD CENTRAL CENTRAL HONG KONG,"329,340",0.00%
B01356,DELTA ASIA SECURITIES LTD,5/F LUK KWOK CENTRE 72 GLOUCESTER ROAD WANCHAI HONG KONG,"327,035",0.00%
B01175,F. R. ZIMMERN LTD,RM 1330 PRINCE'S BUILDING 10 CHATER ROAD CENTRAL HONG KONG,"317,955",0.00%
C00026,CHONG HING BANK LTD,11/F CHONG HING BANK CENTRE 24 DES VOEUX ROAD CENTRAL HONG KONG,"317,164",0.00%
B01450,DL BROKERAGE LTD,1/F WING'S BLDG 110-116 QUEEN'S ROAD CENTRAL HONG KONG,"302,805",0.00%
B01939,CHINA INVESTMENT SECURITIES,RM 7701A & 7705B-7708 LEVEL 77 INTERNATIONAL COMMERCE CENTRE 1 AUSTIN ROAD WEST KOWLOON,"299,349",0.00%
B01416,VC BROKERAGE LTD,28/F THE CENTRIUM 60 WYNDHAM STREET CENTRAL HONG KONG,"286,293",0.00%
B01267,WINFULL SECURITIES LTD,RM 1402 FORTIS BANK TOWER 77-79 GLOUCESTER ROAD WANCHAI HONG KONG,"286,129",0.00%
B01290,SPS SECURITIES LTD,1/F-2/F PINNACLE BUILDING 9 SHIP STREET WANCHAI HONG KONG,"278,331",0.00%
B01298,GET NICE SECURITIES LTD,10/F COSCO TOWER GRAND MILLENNIUM PLAZA 183 QUEEN'S ROAD CENTRAL HONG KONG,"275,768",0.00%
B01425,WELLFULL SECURITIES CO LTD,RM 406 4/F HOUSTON CENTRE 63 MODY ROAD TSIMSHATSUI EAST KOWLOON,"271,803",0.00%
B01686,FIRST SHANGHAI SECURITIES LTD,19/F WING ON HOUSE 71 DES VOEUX ROAD CENTRAL HONG KONG,"266,776",0.00%
B01123,HING WONG SECURITIES LTD,19/F UNIT A&B UNITED CENTRE 95 QUEENSWAY HONG KONG,"257,291",0.00%
B01685,GRAND INVESTMENT (SECURITIES) LTD,UNIT A3 32/F UNITED CENTRE 95 QUEENSWAY HONG KONG,"247,294",0.00%
B01849,CIS SECURITIES ASSET MANAGEMENT LTD,21/F TESBURY CENTRE NO. 24-32 QUEEN'S ROAD EAST WANCHAI HONG KONG,"245,852",0.00%
B01184,OCEANWIDE SECURITIES CO LTD,18/F-19/F CHINA BUILDING 29 QUEEN'S ROAD CENTRAL HONG KONG,"244,931",0.00%
C00011,PUBLIC BANK (HONG KONG) LTD,PUBLIC BANK CENTRE 120 DES VOEUX ROAD CENTRAL HONG KONG,"239,056",0.00%
B01373,CHRISTFUND SECURITIES LTD,SUITE 2701 27/F PROSPERITY TOWER 39 QUEEN'S ROAD CENTRAL HONG KONG,"236,619",0.00%
B01565,GUOTAI JUNAN SECURITIES (HONG KONG) LTD,27/F GRAND MILLENNIUM PLAZA 181 QUEEN'S ROAD CENTRAL HONG KONG,"234,080",0.00%
B01564,ABCI SECURITIES CO LTD,13/F FAIRMONT HOUSE 8 COTTON TREE DRIVE CENTRAL HONG KONG,"233,258",0.00%
B01217,TAIPING SECURITIES (HK) CO LTD,RM 2901 CHINA INSURANCE GROUP BUILDING 141 DES VOEUX ROAD CENTRAL HONG KONG,"230,110",0.00%
B01138,CLSA LTD,18/F ONE PACIFIC PLACE 88 QUEENSWAY HONG KONG,"229,704",0.00%
C00088,CHINA MERCHANTS BANK CO LTD,21/F BANK OF AMERICA TOWER 12 HARCOURT ROAD HONG KONG,"228,472",0.00%
B01271,HANG TAI SECURITIES LTD,RM 506-508 5/F TWO EXCHANGE SQUARE 8 CONNAUGHT PLACE CENTRAL HONG KONG,"219,537",0.00%
B01320,LUEN FAT SECURITIES CO LTD,UNITS 603-605 6/F FWD FINANCIAL CENTRE 308 DES VOEUX ROAD CENTRAL SHEUNG WAN HONG KONG,"218,718",0.00%
B01929,CHINA GALAXY INTERNATIONAL SECURITIES,20/F WING ON CENTRE 111 CONNAUGHT ROAD CENTRAL HONG KONG,"210,756",0.00%
B01252,CORPORATE BROKERS LTD,18/F FORTIS TOWER 77-79 GLOUCESTER ROAD WANCHAI HONG KONG,"207,281",0.00%
B01253,STOCKWELL SECURITIES LTD,UNITS 406-410 4/F TOWER 2 SILVERCORD 30 CANTON ROAD TSIM SHA TSUI KOWLOON,"206,520",0.00%
B01740,BOOM.COM LTD,RM 2501 25/F AIA TOWER 183 ELECTRIC ROAD NORTH POINT HONG KONG,"189,783",0.00%
B01280,WING FAT SECURITIES LTD,RM 603A 6/F ADMIRALTY CENTRE TOWER 1 18 HARCOURT ROAD ADMIRALTY HONG KONG,"185,090",0.00%
B01240,TSUN CHI YUEN SECURITIES CO LTD,20/F MAN ON COMM BLDG 12 JUBILEE ST CENTRAL HONG KONG,"179,956",0.00%
B01231,HONG KONG INTERNATIONAL SECURITIES LTD,23/F ARION COMMERCIAL CENTRE 2-12 QUEEN'S ROAD WEST HONG KONG,"173,076",0.00%
B01556,LUK FOOK SECURITIES (HK) LTD,UNITS 2201-2207 & 2213-2214 22/F COSCO TOWER 183 QUEEN'S ROAD CENTRAL HONG KONG,"167,001",0.00%
B01576,SIU ON SECURITIES LTD,32/F SIU ON CENTRE 188 LOCKHART ROAD WANCHAI HONG KONG,"162,851",0.00%
B01212,HENYEP SECURITIES LTD,10/F NINE QUEEN'S ROAD CENTRAL HONG KONG,"160,618",0.00%
B01230,PACIFIC FOUNDATION SECURITIES LTD,11/F NEW WORLD TOWER II 16-18 QUEEN'S ROAD CENTRAL  HONG KONG,"158,645",0.00%
B01708,ROSA SECURITIES LTD,ROOM 701 9 QUEEN'S ROAD CENTRAL HONG KONG,"155,206",0.00%
B01567,PRIME SECURITIES LTD,ROOM 1601-1602 16/F KAI TAK COMMERCIAL BUILDING 317-319 DES VOEUX ROAD CENTRAL HONG KONG,"153,635",0.00%
B01651,MING HON SECURITIES LTD,RM 602 10 POTTINGER STREET CENTRAL HONG KONG,"153,526",0.00%
B01173,RIFA SECURITIES LTD,LEVEL 7 28 HENNESSY ROAD WANCHAI HONG KONG,"152,293",0.00%
B01607,RHB SECURITIES HONG KONG LTD,12/F WORLDWIDE HOUSE 19 DES VOEUX ROAD CENTRAL HONG KONG,"151,603",0.00%
B01858,YUANTA SECURITIES (HONG KONG) CO LTD,23/F TOWER 1 ADMIRALTY CENTRE 18 HARCOURT ROAD ADMIRALTY HONG KONG,"150,619",0.00%
B01540,UPBEST SECURITIES CO LTD,2/F WAH KIT COMMERCIAL CENTRE 302 DES VOEUX ROAD CENTRAL HONG KONG,"149,204",0.00%
B01552,CARRIER STOCK INVESTMENT CO LTD,FLAT 1A 1/F MAN HING COMMERCIAL BUILDING 79-83 QUEEN'S ROAD CENTRAL CENTRAL HONG KONG,"148,853",0.00%
B01826,GF SECURITIES (HONG KONG) BROKERAGE LTD,29/F-30/F LI PO CHUN CHAMBERS 189 DES VOEUX ROAD CENTRAL HONG KONG,"140,560",0.00%
C00070,OVERSEA-CHINESE BANKING CORPORATION LTD,9/F NINE QUEEN'S ROAD CENTRAL HONG KONG,"140,271",0.00%
B01247,KWAI HUNG SECURITIES CO LTD,19/F ADMIRALTY CENTRE TOWER II 18 HARCOURT ROAD HONG KONG,"139,704",0.00%
B01543,KWONG FAT HONG (SECURITIES) LTD,23/F & 24/F KWONG FAT HONG BUILDING 1 RUMSEY STREET CENTRAL HONG KONG,"136,242",0.00%
B01868,JIMEI SECURITIES LTD,RM 1305-1306 13/F JUBILEE CENTRE 18 FENWICK STREET / 46 GLOUCESTER ROAD WANCHAI HONG KONG,"135,552",0.00%
B01788,SUNRISE SECURITIES LTD,RM 701-702 YUE SHING COMMERCIAL BUILDING 15 QUEEN VICTORIA STREET CENTRAL HONG KONG,"133,877",0.00%
B01581,KINGSWAY FINANCIAL SERVICES GROUP LTD,7/F TOWER 1 LIPPO CENTRE 89 QUEENSWAY HONG KONG,"133,582",0.00%
B01445,VICTORY SECURITIES CO LTD,RM 1101-3 11/F YARDLEY COMMERCIAL BLDG 3 CONNAUGHT ROAD WEST SHEUNG WAN HONG KONG,"133,130",0.00%
B01588,LEI SHING HONG SECURITIES LTD,8/F NEW WORLD TOWER I 18 QUEEN'S ROAD CENTRAL HONG KONG,"130,854",0.00%
B01259,FAIR EAGLE SECURITIES CO LTD,RM 201 2/F CHINA EVERGRANDE CENTRE 38 GLOUCESTER ROAD WANCHAI HONG KONG,"130,724",0.00%
B01894,MAYFAIR & AYERS FINANCIAL GROUP LTD,UNITS 3103A-3108 31/F TOWER 2 LIPPO CENTRE 89 QUEENSWAY ADMIRALTY HONG KONG,"125,000",0.00%
B01296,MONTGOMERY SECURITIES LTD,RM 1203-1204 12/F TAI SANG BANK BLDG 130-132 DES VOEUX ROAD CENTRAL HONG KONG,"122,819",0.00%
B01198,PO KAY SECURITIES & SHARES CO LTD,14/F GRAND BUILDING 15-18 CONNAUGHT ROAD CENTRAL HONG KONG,"122,762",0.00%
B01324,LIPPO SECURITIES LTD,RM 1802 TOWER ONE LIPPO CENTRE 89 QUEENSWAY CENTRAL HONG KONG,"121,896",0.00%
B01340,LEHIN SECURITIES LTD,UNIT 1007 10/F CHINA INSURANCE GROUP BUILDING 141 DES VOEUX ROAD CENTRAL CENTRAL HONG KONG,"121,137",0.00%
B01292,ALPHA SECURITIES CO LTD,RM 3702A 37/F FAR EAST FINANCE CENTRE 16 HARCOURT ROAD ADMIRALTY HONG KONG,"120,808",0.00%
B01483,BULLISH SECURITIES LTD,RM B 7/F HILLIER COMMERCIAL BUILDING 89 WING LOK ST EAST CENTRAL HONG KONG,"120,273",0.00%
B01882,PING AN OF CHINA SECURITIES (HONG KONG),UNITS 3611-3613 36/F THE CENTER 99 QUEEN'S ROAD CENTRAL CENTRAL HONG KONG,"119,628",0.00%
B01782,SEAGA INTERNATIONAL LTD,RM 801 DINA HOUSE RUTTONJEE CENTRE 11 DUDDELL STREET CENTRAL HONG KONG,"119,544",0.00%
B01633,ENLIGHTEN SECURITIES LTD,6/F & 24/F GOLDEN CENTRE 188 DES VOEUX ROAD CENTRAL SHEUNG WAN HONG KONG,"116,944",0.00%
B01706,MAN HON YEUNG SECURITIES LTD,FLAT B 7/F SHUN ON COMMERCIAL BUILDING 112-114 DES VOEUX ROAD CENTRAL HONG KONG,"116,680",0.00%
B01470,HUNG SING SECURITIES LTD,SUITE 2505 25/F WEST TOWER SHUN TAK CENTRE 200 CONNAUGHT ROAD CENTRAL SHEUNG WAN HONG KONG,"112,232",0.00%
B01752,HOI SANG SECURITIES LTD,RM 704 HARVEST BLDG 29-35 WING KUT STREET CENTRAL HONG KONG,"112,160",0.00%
B01238,TAI YIP STOCK CO LTD,RM 304-307 CHINA INSURANCE GROUP BLDG 141 DES VOEUX ROAD CENTRAL HONG KONG,"107,460",0.00%
B01787,SOO PUI CHEN SECURITIES LTD,RM 802 CHEONG K BUILDING 86 DES VOEUX ROAD CENTRAL HONG KONG,"107,185",0.00%
B01469,KAISER SECURITIES LTD,3101-05 31/F WEST TOWER SHUN TAK CENTRE 168-200 CONNAUGHT ROAD CENTRAL SHEUNG WAN HONG KONG,"107,104",0.00%
B01350,S. W. WOO & CO LTD,RM 1803 YUE SHING COMM BLDG 15 QUEEN VICTORIA ST CENTRAL HONG KONG,"106,660",0.00%
B01664,ROOFER SECURITIES LTD,7/F PEARL ORIENTAL HOUSE 60 STANLEY STREET CENTRAL HONG KONG,"105,968",0.00%
B01638,KILMOREY SECURITIES LTD,ROOM 3001 & 3008-3010 ALEXANDRA HOUSE 18 CHATER ROAD CENTRAL HONG KONG,"105,808",0.00%
B01415,TARZAN STOCK & SHARES LTD,6/F HING YIP COMMERCIAL CENTRE 272-284 DES VOEUX ROAD CENTRAL HONG KONG,"105,368",0.00%
B01563,HUARONG INTERNATIONAL SECURITIES LTD,29/F ONE PACIFIC PLACE 88 QUEENSWAY HONG KONG,"102,625",0.00%
B01814,WELL LINK SECURITIES LTD,UNIT 16-18 11/F CHINA MERCHANTS TOWER SHUN TAK CENTRE 168-200 CONNAUGHT ROAD CENTRAL HONG KONG,"101,000",0.00%
,HARMONY ENTERPRISES LIMITED *,C/O HK PRESCHOOL (PICTORIAL) PODIUM PICTORIAL GARDEN PHASE II 23 ON KING STREET SHATIN NEW TERRITORIES,"100,720",0.00%
B01508,SOUTHWEST SECURITIES (HK) BROKERAGE LTD,40/F LEE GARDEN ONE 33 HYSAN AVENUE CAUSEWAY BAY HONG KONG,"98,312",0.00%
B01439,TAI TAK SECURITIES (ASIA) LTD,707A WING ON HOUSE 71 DES VOEUX ROAD CENTRAL HONG KONG,"93,984",0.00%
B01789,HO FUNG SHARES INVESTMENT LTD,FLAT 05-06 1/F WAH PO BUILDING 334-346 SHAU KEI WAN ROAD SHAU KEI WAN HONG KONG,"92,081",0.00%
B01700,REALINK FINANCIAL TRADE LTD,12/F ELITE CENTRE 22 HUNG TO ROAD NGAU TAU KOK KWUN TONG KOWLOON,"89,372",0.00%
B01647,TRUTH SECURITIES LTD,RM 402 4/F KAI WONG COMMERCIAL BUILDING 222 QUEEN'S ROAD CENTRAL HONG KONG,"87,892",0.00%
B01158,SOLID KING SECURITIES LTD,UNITS 1205-6 12/F WEST TOWER SHUN TAK CENTRE 200 CONNAUGHT ROAD CENTRAL HONG KONG,"87,181",0.00%
B01767,NEW GALA SECURITIES CO LTD,RM 1106 REGENT CENTRE 88 QUEEN'S ROAD CENTRAL HONG KONG,"85,328",0.00%
B01765,PROMISING SECURITIES CO LTD,22/F CHUN WO COMMERCIAL CENTRE 23-27 WING WO STREET HONG KONG,"83,700",0.00%
B01947,FUBON SECURITIES (HONG KONG) LTD,UNIT B 41/F @CONVOY 169 ELECTRIC ROAD HONG KONG,"83,260",0.00%
B01566,K.K.M. SECURITIES LTD,23/F 77-83 WANCHAI ROAD WANCHAI HONG KONG,"82,919",0.00%
B01462,PING AN SECURITIES LTD,UNIT 02 2/F CHINA MERCHANTS BUILDING 152-155 CONNAUGHT ROAD CENTRAL HONG KONG,"82,857",0.00%
B01893,WINCO SECURITIES CO LTD,RM 1404 14/F COSCO TOWER 183 QUEEN'S ROAD CENTRAL HONG KONG,"80,500",0.00%
B01866,ICBC INTERNATIONAL SECURITIES LTD,37/F ICBC TOWER 3 GARDEN ROAD HONG KONG,"79,968",0.00%
B01661,HERMES SECURITIES LTD,UNIT 2810 28/F CHINA MERCHANTS TOWER SHUN TAK CENTRE 168-200 CONNAUGHT ROAD CENTRAL HONG KONG,"77,443",0.00%
B01843,TELECOM DIGITAL SECURITIES LTD,UNITS 3608-3612 36/F TOWER 2 METROPLAZA 223 HING FONG ROAD KWAI FONG NEW TERRITORIES,"77,208",0.00%
B01662,BOKHARY SECURITIES LTD,19/F TAK WOO HOUSE 17-19 D'AGUILAR STREET CENTRAL HONG KONG,"76,110",0.00%
B01343,CELETIO INVESTMENTS LTD,ROOM 2202-3 22/F CHINA INSURANCE GROUP BUILDING 141 DES VOEUX ROAD CENTRAL HONG KONG,"75,726",0.00%
B01472,SUN GROWTH SECURITIES LTD,29/F INFINITUS PLAZA 199 DES VOEUX ROAD CENTRAL HONG KONG,"75,609",0.00%
B01848,CATHAY SECURITIES (HONG KONG) LTD,RM 1001 10/F CHINA BUILDING 29 QUEEN'S ROAD CENTRAL HONG KONG,"75,000",0.00%
B01519,GOOD HARVEST SECURITIES CO LTD,7/F HARBOUR COMMERCIAL BUILDING 122-124 CONNAUGHT ROAD CENTRAL CENTRAL HONG KONG,"74,282",0.00%
B01657,JS CRESVALE SECURITIES INTERNATIONAL LTD,UNITS 905-906 9/F TWO HARBOURFRONT 22 TAK FUNG STREET HUNGHOM KOWLOON,"69,920",0.00%
B01407,WIN WONG SECURITIES LTD,26/F SUPREME COMMERCIAL BUILDING 368 KING'S ROAD NORTH POINT HONG KONG,"69,887",0.00%
B01786,KO KUN STOCK CO LTD,FLAT 14B SHING LEE COMMERCIAL BUILDING 6-12 WING KUT STREET CENTRAL HONG KONG,"69,015",0.00%
B01546,WO FUNG SECURITIES CO LTD,2/F SIU YING COMM BLDG 151-155 QUEEN'S ROAD CENTRAL HONG KONG,"67,152",0.00%
B01438,KINGSTON SECURITIES LTD,SUITE 2801  28TH FLOOR ONE INTERNATIONAL FINANCE CENTRE 1 HARBOUR VIEW STREET CENTRAL HONG KONG,"66,529",0.00%
B01433,HING WAI ALLIED SECURITIES LTD,RM 2902-2903 118 CONNAUGHT ROAD WEST HONG KONG,"65,086",0.00%
B01759,WINLAND WEALTH MANAGEMENT LTD,RM 1901 SOUTH CHINA BUILDING 3 WYNDHAM STREET CENTRAL HONG KONG,"65,003",0.00%
B01955,FUTU SECURITIES INTERNATIONAL,11/F BANGKOK BANK BUILDING 14-20 BONHAM STRAND WEST SHEUNG WAN HONG KONG,"64,441",0.00%
B01455,NATIONAL RESOURCES SECURITIES LTD,RM 102 1/F ON HONG COMMERCIAL BUILDING 145 HENNESSY ROAD WANCHAI HONG KONG,"63,260",0.00%
B01968,AYERS ALLIANCE SECURITIES (HK) LTD,SUITES 1812-1814 18/F TWO INTERNATIONAL FINANCE CENTRE 8 FINANCE STREET CENTRAL HONG KONG,"63,000",0.00%
B01520,NORTH SEA SECURITIES LTD,2/F UNIT B WINBASE CENTRE 208 QUEEN'S ROAD CENTRAL HONG KONG,"60,681",0.00%
,HONG KONG SECURITIES CLEARING CO. LTD.,12/F ONE INTERNATIONAL FINANCE CENTRE 1 HARBOUR VIEW STREET CENTRAL HONG KONG,"60,647",0.00%
B01473,SUNNY WORLD INVESTMENT LTD,10/F SIBERIAN BLDG 29 DES VOEUX ROAD CENTRAL HONG KONG,"60,306",0.00%
B01597,TIMES SECURITIES CO LTD,SUITE 3110 TOWER I LIPPO CENTRE 89 QUEENSWAY HONG KONG,"58,923",0.00%
B01646,TAI NING STOCK CO LTD,13/F WINGS BUILDING 110-116 QUEEN'S ROAD CENTRAL HONG KONG,"58,752",0.00%
B01714,HEAD & SHOULDERS SECURITIES LTD,ROOM 2511 25/F COSCO TOWER 183 QUEEN'S ROAD CENTRAL HONG KONG,"58,509",0.00%
B01514,KARL-THOMSON SECURITIES CO LTD,RM 607-610 6/F TAI YAU BUILDING 181 JOHNSTON ROAD WANCHAI HONG KONG,"57,492",0.00%
B01606,EWARTON SECURITIES LTD,RM 1009 10/F WING ON CENTRE 111 CONNAUGHT ROAD CENTRAL SHEUNG WAN HONG KONG,"56,940",0.00%
B01460,BERICH BROKERAGE LTD,3/F SHUM TOWER 268 DES VOEUX ROAD CENTRAL HONG KONG,"56,165",0.00%
B01342,WAH THAI SECURITIES LTD,RM 202 2/F GENERAL COMMERCIAL BUILDING 156-164 DES VOEUX ROAD CENTRAL HONG KONG,"54,598",0.00%
B01351,WING FUNG SECURITIES LTD,20/F WING ON HOUSE 71 DES VOEUX ROAD CENTRAL CENTRAL HONG KONG,"54,368",0.00%
B01677,ANUE SECURITIES LTD,28/F GUANGDONG TOURS CENTER 18 PENNINGTON STREET CAUSEWAY BAY HONG KONG,"53,865",0.00%
B01575,MASTER TRADEMORE SECURITIES LTD,12/F SHUM TOWER 268 DES VOEUX ROAD CENTRAL HONG KONG,"53,783",0.00%
B01328,BAN HIN SECURITIES CO LTD,RM 901-2 LANSING HSE 41-47 QUEEN'S RD C CENTRAL HONG KONG,"53,592",0.00%
B01551,YUE XIU SECURITIES CO LTD,28/F SIU ON CENTRE 188 LOCKHART ROAD WANCHAI HONG KONG,"53,476",0.00%
B01458,YICKO SECURITIES LTD,19TH FLOOR TUNG NING BUILDING 125-7 CONNAUGHT ROAD CENTRAL HONG KONG,"53,266",0.00%
B01191,OKACHI INVESTMENTS (HONG KONG) CO LTD,6/F EURO TRADE CTR 13-14 CONNAUGHT RD CENTRAL HONG KONG,"51,772",0.00%
B01341,TUNG TAI SECURITIES CO LTD,RM 508 TWO EXCHANGE SQUARE 8 CONNAUGHT PLACE CENTRAL HONG KONG,"50,674",0.00%
B01535,WING YEE SECURITIES CO LTD,RM 1803 CHAMPION BUILDING 287-291 DES VOEUX ROAD CENTRAL SHEUNG WAN HONG KONG,"50,593",0.00%
,SIU YUK LUNG *,UNIT A 15/F KINGS WING PLAZA 2 1 ON KWAN STREET SHATIN NEW TERRITORIES,"50,524",0.00%
B01559,HING LEE SECURITIES LTD,RM 3008 TOWER 6 THE GATEWAY HARBOUR CITY TSIMSHATSUI KOWLOON,"50,268",0.00%
B01783,FREDDY CO LTD,RM 2102 21/F MELBOURNE PLAZA 33 QUEEN'S ROAD CENTRAL CENTRAL HONG KONG,"50,223",0.00%
B01144,TAK FUNG SHARES INVESTMENT CO LTD,8/F WAH YUEN BLDG 145-149 QUEEN'S RD CENTRAL HONG KONG,"49,888",0.00%
B01501,GOLDRIDE SECURITIES LTD,17/F 8 LYNDHURST TERRACE NO. 2-10 LYNDHURST TERRACE CENTRAL HONG KONG,"47,556",0.00%
B01669,FIRST SECURITIES (HK) LTD,RM 1708-1710 17/F CHINA INSURANCE GROUP BUILDING 141 DES VOEUX ROAD CENTRAL HONG KONG,"47,460",0.00%
B01389,ZHONGRONG PT SECURITIES LTD,RM 201A 2/F CHINA BUILDING 29 QUEEN'S ROAD CENTRAL HONG KONG,"47,217",0.00%
B01938,CHINA INDUSTRIAL SECURITIES,32/F INFINITUS PLAZA 199 DES VOEUX ROAD CENTRAL SHEUNG WAN HONG KONG,"46,125",0.00%
,POON MIU FONG *,FLAT 6C BLOCK 10 DEERHILL BAY DEERHILL VILLAS 4699 TAI PO ROAD TAI PO KAU TAI PO NEW TERRITORIES,"45,412",0.00%
B01665,WINSOME STOCK CO LTD,TOP FLOOR WING SHUN BUILDING 64-66 BONHAM STRAND WEST HONG KONG,"45,088",0.00%
B01973,PC SECURITIES LTD,UNIT A 11/F LEE GARDEN FIVE 18 HYSAN AVENUE CAUSEWAY BAY HONG KONG,"44,784",0.00%
