B01710,SINO-RICH SECURITIES & FUTURES LTD,3702B FAR EAST FINANCE CENTRE 16 HARCOURT ROAD ADMIRALTY HONG KONG,"44,751",0.00%
B01806,CHINA GATHER WEALTH FINANCIAL CO LTD,UNIT A1 & A2 12/F LIPPO LEIGHTON TOWER 103 LEIGHTON ROAD CAUSEWAY BAY HONG KONG,"44,656",0.00%
B01777,DAIWA CAPITAL MARKETS HONG KONG LTD,LEVEL 26 ONE PACIFIC PLACE 88 QUEENSWAY HONG KONG,"44,356",0.00%
B01636,BUSINESS SECURITIES LTD,21/F HOLD WIN CENTRE 83 QUEEN'S ROAD EAST WANCHAI HONG KONG,"44,092",0.00%
C00004,"MUFG BANK, LTD.",5/F AIA CENTRAL 1 CONNAUGHT ROAD CENTRAL HONG KONG,"43,940",0.00%
B01443,YING WAH SECURITIES CO LTD,RM A 3/F FOO CHEONG BUILDING 82-86 WING LOK STREET SHEUNG WAN HONG KONG,"43,284",0.00%
B01550,HUAYU SECURITIES LTD,SUITE 930 9/F OCEAN CENTRE HARBOUR CITY 5 CANTON ROAD KOWLOON,"41,977",0.00%
B01555,ABN AMRO CLEARING HONG KONG LTD,LEVEL 70 INTERNATIONAL COMMERCE CENTRE 1 AUSTIN ROAD WEST KOWLOON,"40,637",0.00%
B01428,HIP HING SECURITIES LTD,11/F DUKE WELLINGTON BLDG 14-24 WELLINGTON ST CENTRAL HONG KONG,"38,444",0.00%
B01676,TAI SHING STOCK INVESTMENT CO LTD,ROOM 801-804 HALESON BUILDING 1 JUBILEE STREET CENTRAL HONG KONG,"38,090",0.00%
B01666,CHINA GOLDJOY SECURITIES LTD,UNITS 1704-1706 17/F INFINITUS PLAZA 199 DES VOEUX ROAD CENTRAL HONG KONG,"37,776",0.00%
B01696,HANTEC SECURITIES CO LTD,12/F SOUTH CHINA BUILDING 1-3 WYNDHAM STREET CENTRAL HONG KONG,"36,998",0.00%
B01294,CS WEALTH SECURITIES LTD,RM 3206 32/F CHINA RESOURCES BUILDING 26 HARBOUR ROAD WANCHAI HONG KONG,"36,546",0.00%
B01525,KEE CHEONG SECURITIES CO LTD,1/F SUN MONG HOUSE 50-56 MONGKOK ROAD MONGKOK KOWLOON,"36,460",0.00%
B01769,ONE CHINA SECURITIES LTD,2/F CHEONG K. BUILDING 84-86 DES VOEUX ROAD CENTRAL HONG KONG,"36,216",0.00%
B01784,FU YIP SECURITIES AND INVESTMENT CO LTD,FLAT F 4/F SHING LEE COMMERCIAL BUILDING 6-12 WING KUT STREET CENTRAL HONG KONG,"36,123",0.00%
B01731,SHUN HENG SECURITIES LTD,SUITE 5107 51/F CENTRAL PLAZA 18 HARBOUR ROAD WANCHAI HONG KONG,"35,441",0.00%
B01645,SELINA & CO LTD,RM 601-602 6/F PETER BUILDING 58-60 QUEEN'S ROAD CENTRAL HONG KONG,"35,052",0.00%
B01761,KO'S BROTHER SECURITIES CO LTD,"UNITS 1A&B, 2C & 6A KO'S HOUSE 577 NATHAN ROAD MONGKOK KOWLOON","34,364",0.00%
B01310,TUNG TAK SECURITIES (H.K.) CO LTD,G/F 169 TAI NAM ST SHAMSHUIPO KOWLOON,"34,128",0.00%
B01659,CHEER UNION SECURITIES LTD,15/F WORLD TRUST TOWER 50 STANLEY STREET CENTRAL HONG KONG,"34,012",0.00%
B01297,ONSHINE SECURITIES LTD,21/F ENTERTAINMENT BLDG 30 QUEEN'S ROAD CENTRAL HONG KONG,"33,928",0.00%
B01632,WAI FAT SECURITIES LTD,FLAT D  4/F  MONGKOK BUILDING 546-548 NATHAN ROAD MONGKOK KOWLOON,"33,812",0.00%
B01940,8 SECURITIES LTD,17/F THE L. PLACE 139 QUEEN'S ROAD CENTRAL CENTRAL HONG KONG,"33,184",0.00%
B01213,MALAHON SECURITIES LTD,5-6/F 17/F & 21/F MALAHON CENTRE 8-12 STANLEY STREET CENTRAL HONG KONG,"33,017",0.00%
B01724,RAMON INVESTMENT CO LTD,RM 201-5 2/F KOWLOON CENTRE 29-39 ASHLEY ROAD KOWLOON,"32,860",0.00%
B01609,WILBY SECURITIES LTD,14/F OTB BUILDING 259-265 DES VOEUX ROAD CENTRAL HONG KONG,"32,548",0.00%
B01890,GUOSEN SECURITIES (HK) BROKERAGE CO LTD,42/F TWO INTERNATIONAL FINANCE CENTRE 8 FINANCE STREET CENTRAL HONG KONG,"32,420",0.00%
B01825,GUOYUAN SECURITIES BROKERAGE (HONG KONG),22/F CCB TOWER 3 CONNAUGHT ROAD CENTRAL CENTRAL HONG KONG,"31,948",0.00%
B01699,MASTERLINK SECURITIES (HONG KONG),26/F BONHAM TRADE CENTRE 50 BONHAM STRAND SHEUNG WAN HONG KONG,"31,736",0.00%
B01705,HENIK SECURITIES LTD,7/F CHEONG SUN TOWER 118 WING LOK STREET SHEUNG WAN HONG KONG,"31,652",0.00%
B01318,OKASAN INTERNATIONAL (ASIA) LTD,RM 4601-4603 46/F THE CENTER 99 QUEEN'S ROAD CENTRAL HONG KONG,"31,116",0.00%
B01592,PLATINUM BROKING CO LTD,21/F LHT TOWER 31 QUEEN'S ROAD CENTRAL HONG KONG,"31,052",0.00%
B01323,DEUTSCHE SECURITIES ASIA LTD,52/F INTERNATIONAL COMMERCE CENTRE 1 AUSTIN ROAD WEST KOWLOON,"31,000",0.00%
B01941,CENTALINE SECURITIES LTD,UNIT 1003-1005 10/F MIRA PLACE TOWER A 132 NATHAN ROAD TSIM SHA TSUI KOWLOON,"30,944",0.00%
B01792,HONG KONG WAN KIU INVESTMENT CO LTD,RM 1303 13/F ON LOK YUEN BUILDING 25 DES VOEUX ROAD CENTRAL HONG KONG,"30,752",0.00%
B01547,KWOK HING SECURITIES LTD,RM 702 FAR EAST CONSORTIUM BUILDING 121 DES VOEUX ROAD CENTRAL HONG KONG,"30,500",0.00%
B01678,GLS SECURITIES LTD,ROOM 1001 HONG KONG HOUSE 17-19 WELLINGTON STREET CENTRAL HONG KONG,"30,116",0.00%
B01684,WING ON SECURITIES LTD,RM 1706-7 CHINA INSURANCE GROUP BUILDING 141 DES VOEUX ROAD CENTRAL HONG KONG,"30,113",0.00%
,"BARNETT MATTHEW JOHN, BARNETT DIANA *",FLAT 12B KADOORIE AVENUE MANSION 205-207 PRINCE EDWARD ROAD WEST HOMANTIN KOWLOON,"29,996",0.00%
B01749,TANG KEE SECURITIES LTD,RM 803 8/F CHINA INSURANCE GROUP BLDG 141 DES VOEUX ROAD CENTRAL CENTRAL HONG KONG,"28,986",0.00%
B01642,KMT SECURITIES LTD,G/F SUNSHINE MANSION 46/46A FORT STREET HONG KONG,"28,732",0.00%
B01917,CHINA TIMES SECURITIES LTD,RM 503 5/F THE SUN'S GROUP CENTRE 200 GLOUCESTER ROAD HONG KONG,"28,472",0.00%
B01855,VISION FINANCE (SECURITIES) LTD,RM 23A YARDLEY COMMERCIAL BUILDING 3 CONNAUGHT ROAD WEST HONG KONG,"28,000",0.00%
B01712,WAH SANG SECURITIES LTD,UNIT B 16/F WINBASE CENTRE 208 QUEEN'S ROAD CENTRAL HONG KONG,"27,996",0.00%
B01904,VALUABLE CAPITAL LTD,RM 2815 28/F CHINA MERCHANTS TOWER SHUN TAK CENTRE 168-200 CONNAUGHT RD CENTRAL SHEUNG WAN HONG KONG,"27,920",0.00%
B01401,MEGABASE SECURITIES LTD,RM 608-609 6/F ONE ISLAND SOUTH 2 HEUNG YIP ROAD HONG KONG,"27,916",0.00%
B01780,TUNG SHUN SECURITIES LTD,RM 202 PETER BUILDING 58-62 QUEEN'S ROAD CENTRAL HONG KONG,"27,828",0.00%
B01615,KAM FAI SECURITIES CO LTD,21/F CHAMPION BUILDING 287-291 DES VOEUX ROAD CENTRAL HONG KONG,"27,628",0.00%
B01925,BMI SECURITIES LTD,SUITES 909-916 SHUI ON CENTRE 6-8 HARBOUR ROAD WANCHAI HONG KONG,"25,812",0.00%
B01383,RICH PLEASURE SECURITIES LTD,2/F AMTEL BUILDING 144-148 DES VOEUX ROAD CENTRAL CENTRAL HONG KONG,"25,760",0.00%
B01459,IFAST SECURITIES (HK) LTD,SUITE 1303 TWO EXCHANGE SQUARE 8 CONNAUGHT PLACE CENTRAL HONG KONG,"25,500",0.00%
B01265,OCBC WING HANG SHARES BROKERAGE CO. LTD,1/F CHUN WO COMMERCIAL CENTRE 23-29 WING WO STREET CENTRAL HONG KONG,"25,241",0.00%
B01444,BAILI SECURITIES CO LTD,10/F TERN CENTRE TOWER 1 237 QUEEN'S ROAD CENTRAL SHEUNG WAN HONG KONG,"24,840",0.00%
B01964,HALCYON SECURITIES LTD,11/F 8 WYNDHAM STREET CENTRAL HONG KONG,"24,288",0.00%
B01493,YARDLEY SECURITIES LTD,20/F V-HEUN BUILDING 138 QUEEN'S ROAD CENTRAL HONG KONG,"24,240",0.00%
B01794,INTERCONTINENT SECURITIES CO LTD,RM 1802 CAR PO COMMERCIAL BUILDING 37-43 POTTINGER STREET HONG KONG,"24,104",0.00%
B01832,MIZUHO SECURITIES ASIA LTD,14/F-15/F K11 ATELIER 18 SALISBURY ROAD TSIM SHA TSUI KOWLOON,"23,780",0.00%
B01680,SUCCESS SECURITIES LTD,SUITE 1603-1607 16/F GREAT EAGLE CENTRE 23 HARBOUR ROAD WANCHAI HONG KONG,"23,528",0.00%
B01585,SINO GRADE SECURITIES LTD,RM 604 TAI PO COMMERCIAL CENTRE 152-172 KWONG FUK ROAD TAI PO NEW TERRITORIES,"23,340",0.00%
B01523,EVER-LONG SECURITIES CO LTD,18/F DAH SING LIFE BUILDING 99 DES VOEUX ROAD CENTRAL HONG KONG,"23,104",0.00%
B01427,SINCERE SECURITIES LTD,9/F COSCO TOWER 183 QUEEN'S ROAD CENTRAL HONG KONG,"23,102",0.00%
B01141,FE SECURITIES LTD,4/F HENLEY BUILDING 5 QUEEN'S ROAD CENTRAL HONG KONG,"22,222",0.00%
B01181,FOSUN HANI SECURITIES LTD,SUITE 2101-2105 21/F CHAMPION TOWER 3 GARDEN ROAD CENTRAL HONG KONG,"22,012",0.00%
B01930,PRIME COURAGE SECURITIES CO LTD,UNIT A 23/F 88 LOCKHART ROAD WANCHAI HONG KONG,"21,934",0.00%
B01660,GRANSING SECURITIES CO LTD,17/F HING YIP COMMERCIAL CENTRE 272-284 DES VOEUX ROAD CENTRAL CENTRAL HONG KONG,"21,890",0.00%
B01976,FRONTIER CAPITAL MANAGEMENT LTD,23/F THREE EXCHANGE SQUARE 8 CONNAUGHT PLACE CENTRAL HONG KONG,"21,840",0.00%
B01614,CHINA HONG KONG CAPITAL ASSET MANAGEMENT,8/F ST. JOHN'S BUILDING 33 GARDEN ROAD CENTRAL HONG KONG,"21,552",0.00%
B01951,GENTING SECURITIES LTD,SUITE 1501 OCEAN CENTRE 5 CANTON ROAD TSIMSHATSUI KOWLOON,"21,520",0.00%
B02020,WEALTH LINK SECURITIES LTD,UNIT B1 5/F GUANGDONG INVESTMENT TOWER 148 CONNAUGHT ROAD CENTRAL HONG KONG,"21,500",0.00%
B01779,LEE'S SECURITIES CO LTD,UNIT B 19/F TWO CHINACHEM PLAZA 135 DES VOEUX ROAD CENTRAL HONG KONG,"21,392",0.00%
B01277,BRADBURY SECURITIES LTD,RM 06-07 58/F THE CENTER 99 QUEEN'S ROAD CENTRAL HONG KONG,"21,340",0.00%
B01897,CENTRAL WEALTH SECURITIES INVESTMENT LTD,UNIT 6708A LEVEL 67 INTERNATIONAL COMMERCE CENTRE 1 AUSTIN ROAD WEST KOWLOON,"21,005",0.00%
B01863,CAPITEC SECURITIES LTD,UNIT 1405-1407 14/F CHINA MERCHANTS STEAM NAVIGATION BLDG 303-307 DES VOEUX ROAD CENTRAL HONG KONG,"21,000",0.00%
B01248,KWAN YICK SECURITIES (INTERNATIONAL) LTD,FLAT B & C 3/F HO LEE COMM BLDG 38-44 D'AGUILAR ST CENTRAL HONG KONG,"20,677",0.00%
B01654,CHINA INTERNATIONAL CAPITAL CORPORATION,29/F ONE INTERNATIONAL FINANCE CENTRE 1 HARBOUR VIEW STREET CENTRAL HONG KONG,"20,604",0.00%
B01715,PRESIDENT SECURITIES (HONG KONG) LTD,UNITS 2603-2606 26/F INFINITUS PLAZA 199 DES VOEUX ROAD CENTRAL HONG KONG,"20,461",0.00%
B01322,INFAST BROKERAGE LTD,18/F 8 LYNDHURST TERRACE 2-10 LYNDHURST TERRACE CENTRAL HONG KONG,"20,238",0.00%
B02025,ASIA WEALTH SECURITIES LTD,6/F FUNG HOUSE 19-20 CONNAUGHT ROAD CENTRAL HONG KONG,"20,000",0.00%
B01604,HUABANG SECURITIES LTD,RM 2901-2902 29/F ENTERPRISE SQUARE TWO 3 SHEUNG YUET ROAD KOWLOON BAY KOWLOON,"18,688",0.00%
B01457,MARS SECURITIES CO LTD,2/F CHUNG NAM HSE 59 DES VOEUX ROAD CENTRAL HONG KONG,"18,208",0.00%
B01454,HAO TIAN INTERNATIONAL SECURITIES LTD,10/F 80 GLOUCESTER ROAD WANCHAI HONG KONG,"17,896",0.00%
B01728,AJ SECURITIES LTD,UNIT 3908-3909 39/F COSCO TOWER 183 QUEEN'S ROAD CENTRAL SHEUNG WAN HONG KONG,"17,574",0.00%
B01809,CHINA SYSTEM SECURITIES LTD,12/F TUNG HIP COMMERCIAL BUILDING 252 DES VOEUX ROAD CENTRAL HONG KONG,"17,524",0.00%
B01577,YF SECURITIES CO LTD,11/F CMA BUILDING 64-66 CONNAUGHT ROAD CENTRAL HONG KONG,"17,120",0.00%
B01558,GOLD FUND SECURITIES CO LTD,RM 1102 HARVEST BUILDING 29-35 WING KUT STREET CENTRAL HONG KONG,"16,576",0.00%
B02078,AFFLUX SECURITIES LTD,UNIT 2208-2209 CHINA INSURANCE GROUP BUILDING 141 DES VOEUX ROAD CENTRAL HONG KONG,"16,500",0.00%
B01531,LAU & CO LTD,RM 801 PARKER HOUSE 72 QUEEN'S ROAD CENTRAL HONG KONG,"16,480",0.00%
B01648,ASIA PACIFIC SECURITIES LTD,SUITE 1005 10/F LANSING HOUSE 41 QUEEN'S ROAD CENTRAL HONG KONG,"16,420",0.00%
B01959,ZHONGTAI INTERNATIONAL SECURITIES LTD,7/F LI PO CHUN CHAMBERS 189 DES VOEUX ROAD CENTRAL HONG KONG,"16,369",0.00%
B01906,SUN INTERNATIONAL SECURITIES LTD,UNIT 2412-2413 24/F CHINA MERCHANTS TOWER SHUN TAK CENTRE 168-200 CONNAUGHT ROAD CENTRAL HONG KONG,"15,944",0.00%
B01421,CSL SECURITIES LTD,RM 1406-1412 14/F NAN FUNG TOWER 88 CONNAUGHT ROAD CENTRAL CENTRAL HONG KONG,"15,568",0.00%
B01266,TANRICH ASIA-PAC SECURITIES LTD,SUITE 801 CENTRAL PLAZA 18 HARBOUR ROAD WANCHAI HONG KONG,"15,208",0.00%
B01521,CHAN NGOK MING SECURITIES LTD,RM 201 CONWELL HOUSE 34-38 STANLEY STREET CENTRAL HONG KONG,"15,125",0.00%
B01967,YUNFENG SECURITIES LTD,SUITES 3201-3204 ONE EXCHANGE SQUARE 8 CONNAUGHT ROAD CENTRAL HONG KONG,"15,050",0.00%
B01739,CHUNG LEE SECURITIES CO LTD,RM 601-602 JUBILEE CENTRE 18 FENWICK STREET WANCHAI HONG KONG,"14,694",0.00%
B01726,C.P. SECURITIES INTERNATIONAL LTD,RM 2707 27/F CHINA RESOURCES BUILDING 26 HARBOUR ROAD WANCHAI HONG KONG,"14,344",0.00%
B01372,FIRST WORLDSEC SECURITIES LTD,RM 1003 10/F INFINITUS PLAZA 199 DES VOEUX ROAD CENTRAL HONG KONG,"13,788",0.00%
B01528,EAA SECURITIES LTD,UNIT 2306 23/F 9 QUEEN'S ROAD CENTRAL HONG KONG,"13,776",0.00%
B01771,ETERNAL PEARL SECURITIES LTD,19/F 88 GLOUCESTER ROAD WANCHAI HONG KONG,"13,656",0.00%
B01900,ORIENT SECURITIES (HONG KONG) LTD,28/F 100 QUEEN'S ROAD CENTER 100 QRC CENTRAL HONG KONG,"13,392",0.00%
B01434,BEEVEST SECURITIES LTD,SUITES 1110-1111 11/F TOWER 6 THE GATEWAY HARBOUR CITY TSIMSHATSUI KOWLOON,"13,276",0.00%
B01481,NEW REGION SECURITIES CO LTD,UNIT A 19/F DAH SING LIFE BUILDING 99 DES VOEUX ROAD CENTRAL HONG KONG,"13,212",0.00%
B01751,JOHN & WONG SECURITIES CO LTD,9/F MALAHON CENTRE 10-12 STANLEY STREET HONG KONG,"12,986",0.00%
B01510,ORIENTAL PATRON SECURITIES LTD,27/F TWO EXCHANGE SQUARE 8 CONNAUGHT PLACE CENTRAL HONG KONG,"12,368",0.00%
B01386,SBI CHINA CAPITAL FINANCIAL SERVICES LTD,UNIT A2 32/F UNITED CENTRE 95 QUEENSWAY HONG KONG,"12,004",0.00%
B01608,TAIWAN CONCORD CAPITAL SECURITIES (HONG,18/F CENTRAL TOWER 28 QUEEN'S ROAD CENTRAL CENTRAL HONG KONG,"11,944",0.00%
B01679,TAI FUNG SECURITIES LTD,3/F TACK BUILDING 48 GILMAN STREET HONG KONG,"11,920",0.00%
,YEUNG MIU YING *,FLAT A 15/F BLOCK 2 EDEN GARDEN 9-11 LOK FUNG PATH FO TAN SHATIN NEW TERRITORIES,"11,760",0.00%
B01509,UNICORN SECURITIES CO LTD,RM 503 GENERAL COMMERCIAL BUILDING 156-164 DES VOEUX ROAD CENTRAL HONG KONG,"11,660",0.00%
B01569,TANG PING KONG LTD,UNIT 306 3/F PRINTING HOUSE 6 DUDDELL STREET CENTRAL HONG KONG,"11,592",0.00%
B01601,CSC SECURITIES (HK) LTD,UNIT 3204-3207 32/F COSCO TOWER GRAND MILLENNIUM PLAZA 183 QUEEN'S ROAD CENTRAL HONG KONG,"11,552",0.00%
B01942,SINO WEALTH SECURITIES LTD,UNIT 2401 24/F BANK OF EAST ASIA HARBOUR VIEW CENTRE 56 GLOUCESTER ROAD WANCHAI HONG KONG,"11,260",0.00%
B01385,FAIRWIN BROKING LTD,RM 11 7/F LIPPO SUN PLAZA 28 CANTON ROAD TSIM SHA TSUI KOWLOON,"11,052",0.00%
B01901,CMB INTERNATIONAL SECURITIES LTD,45/F CHAMPION TOWER 3 GARDEN ROAD CENTRAL HONG KONG,"11,000",0.00%
B01410,CHINA RICH SECURITIES LTD,UNIT 1401 14/F LOW BLOCK GRAND MILLENNIUM PLAZA 181 QUEEN'S ROAD CENTRAL HONG KONG,"10,424",0.00%
B01741,SINOMAX SECURITIES LTD,UNIT 2705-2706 27/F TOWER 1 LIPPO CENTRE 89 QUEENSWAY HONG KONG,"10,368",0.00%
B01753,FORTUNE (HK) SECURITIES LTD,ROOM 4301-4308 & 4313 COSCO TOWER 183 QUEEN'S ROAD CENTRAL SHEUNG WAN HONG KONG,"10,260",0.00%
B01417,CHEE TAK SECURITIES LTD,13/F WING YEE COMMERCIAL BLDG 5 WING KUT STREET CENTRAL HONG KONG,"10,097",0.00%
,CHAN YIM TAO MARGARET *,FLAT A 8/F BLOCK A-B GREENVIEW GARDENS 125 ROBINSON ROAD HONG KONG,"10,000",0.00%
,TUNG SAI YI *,FLAT A 15/F PRINCE RITZ 448 PRINCE EDWARD ROAD WEST KOWLOON CITY KOWLOON,"10,000",0.00%
B01915,9F PRIMASIA SECURITIES LTD,SUITE 4806-07 48/F CENTRAL PLAZA 18 HARBOUR ROAD WANCHAI HONG KONG,"10,000",0.00%
B01080,VMS SECURITIES LTD,49/F ONE EXCHANGE SQUARE 8 CONNAUGHT PLACE CENTRAL HONG KONG,"9,960",0.00%
B01773,TOYO SECURITIES ASIA LTD,UNIT 502 5/F HENLEY BUILDING 5 QUEEN'S ROAD CENTRAL HONG KONG,"9,620",0.00%
B01720,NORMAN KONG SECURITIES CO LTD,RM 504 MONGKOK COMMERCIAL CENTRE 16 ARGYLE STREET MONGKOK KOWLOON,"9,208",0.00%
,FUNG SHIU LAN RUBY *,LOT 1098 DD 253 PAK SHEK WO CLEAR WATER BAY ROAD TSENG LAN SHUE SAI KUNG NEW TERRITORIES,"9,000",0.00%
B01524,GOLDEN HILL INVESTMENT CO LTD,21/F GOLDEN STAR BLDG 20-24 LOCKHART ROAD WANCHAI HONG KONG,"9,000",0.00%
B01653,WAI MAN STOCK & SHARES CO LTD,RM 2 2/F LAI KWAN COURT 438 CASTLE PEAK ROAD CHEUNG SHA WAN KOWLOON,"9,000",0.00%
B01962,CHINA SECURITIES (INTERNATIONAL),18/F TWO EXCHANGE SQUARE 8 CONNAUGHT PLACE CENTRAL HONG KONG,"9,000",0.00%
B01477,FT SECURITIES LTD,22/F FORTIS TOWER 77-79 GLOUCESTER ROAD WANCHAI HONG KONG,"8,526",0.00%
B01776,AIF SECURITIES LTD,RM 3206 32/F BANK OF AMERICA TOWER 12 HARCOURT ROAD CENTRAL HONG KONG,"8,288",0.00%
B01260,LAMTEX SECURITIES LTD,RM 716 STAR HOUSE 3 SALISBURY ROAD TSIMSHATSUI KOWLOON,"8,182",0.00%
B01402,PHOENIX CAPITAL SECURITIES LTD,RM 503 5/F TOWER II ADMIRALTY CENTRE 18 HARCOURT ROAD HONG KONG,"8,156",0.00%
B01732,WINTECH SECURITIES LTD,UNIT F 20/F CHINA OVERSEAS BUILDING 139 HENNESSY ROAD WANCHAI HONG KONG,"8,052",0.00%
B01702,BLACK MARBLE SECURITIES LTD,21/F THE WELLINGTON 184-198 WELLINGTON STREET CENTRAL HONG KONG,"8,000",0.00%
B01831,GLORY SKY GLOBAL MARKETS LTD,13/F AIA TOWER 183 ELECTRIC ROAD NORTH POINT HONG KONG,"7,868",0.00%
B01256,SINOLINK SECURITIES (HONG KONG) CO LTD,"UNITS 2503, 2505-2506 25/F LOW BLOCK GRAND MILLENNIUM PLAZA 181 QUEEN'S ROAD CENTRAL HONG KONG","7,840",0.00%
B01650,KAM LUEN SECURITIES LTD,UNIT 2702 27/F GOLDEN CENTRE 188 DES VOEUX ROAD CENTRAL HONG KONG,"7,561",0.00%
B01914,JEFFERIES HONG KONG LTD,SUITE 2201 22/F CHEUNG KONG CENTER 2 QUEEN'S ROAD CENTRAL HONG KONG,"7,310",0.00%
C00099,"TAISHIN INTERNATIONAL BANK CO., LTD",6/F SUN LIFE TOWER THE GATEWAY 15 CANTON ROAD TSIMSHATSUI KOWLOON,"7,184",0.00%
B01346,CHINA PACIFIC SECURITIES LTD,RM 1008 CHINA INSURANCE GROUP BUILDING 141 DES VOEUX ROAD CENTRAL HONG KONG,"7,000",0.00%
B01404,HONG KONG STOCK LINK SECURITIES LTD,11A CKK COMMERCIAL CENTRE 289 HENNESSY ROAD WANCHAI HONG KONG,"6,552",0.00%
,YIP LAI YING *,UNIT C 3/F TOWER 1 VISTA PARADISO 2 HANG MING STREET MA ON SHAN NEW TERRITORIES,"6,000",0.00%
B01157,PASAY STOCK AND SHARES LTD,RM 905 WORLD-WIDE HSE 19 DES VOEUX RD CENTRAL HONG KONG,"6,000",0.00%
B01833,CTBC ASIA LTD,RM 2809 28/F TWO INTERNATIONAL FINANCE CENTRE 8 FINANCE STREET CENTRAL HONG KONG,"6,000",0.00%
B01969,CM SECURITIES (HONGKONG) CO LTD,SUITE 1004 10/F CITIBANK PLAZA ICBC TOWER 3 GARDEN ROAD CENTRAL HONG KONG,"6,000",0.00%
B01829,HUATAI FINANCIAL HOLDINGS (HONG KONG),RM 5808-5812 58/F THE CENTER 99 QUEEN'S ROAD CENTRAL HONG KONG,"5,868",0.00%
B01743,CEPA ALLIANCE SECURITIES LTD,UNIT 2603-2605 26/F FWD FINANCIAL CENTRE 308-320 DES VOEUX ROAD CENTRAL HONG KONG,"5,788",0.00%
B01802,REDFORD SECURITIES LTD,RM 2705 27/F SINO PLAZA 255-257 GLOUCESTER ROAD CAUSEWAY BAY HONG KONG,"5,788",0.00%
B01716,ORIENT SECURITIES LTD,RM 3101 31/F CHINA MERCHANTS TOWER SHUN TAK CENTRE 168-200 CONNAUGHT ROAD CENTRAL HONG KONG,"5,500",0.00%
B01907,CHINA DEMETER SECURITIES LTD,3/F CENTRAL 88 88-98 DES VOEUX ROAD CENTRAL CENTRAL HONG KONG,"5,500",0.00%
B01768,WINTONE SECURITIES LTD,RM 1304 13/F FWD FINANCIAL CENTRE 308 DES VOEUX ROAD CENTRAL HONG KONG,"5,420",0.00%
B02019,GEO SECURITIES LTD,RM 1707 17/F HARCOURT HOUSE 39 GLOUCESTER ROAD WANCHAI HONG KONG,"5,420",0.00%
B01859,CLC SECURITIES LTD,13/F NAN FUNG TOWER 88 CONNAUGHT ROAD CENTRAL CENTRAL HONG KONG,"5,000",0.00%
B01875,GUODU SECURITIES (HONG KONG) LTD,RM 1307 13/F BANK OF AMERICA TOWER 12 HARCOURT ROAD CENTRAL HONG KONG,"5,000",0.00%
B01975,SUPREME CHINA SECURITIES LTD,SUITES 2701-2702 27/F EVERBRIGHT CENTRE 108 GLOUCESTER ROAD WANCHAI HONG KONG,"5,000",0.00%
B01982,CENTRAL CHINA INTERNATIONAL SECURITIES,SUITES 1505-1508 TWO EXCHANGE SQUARE 8 CONNAUGHT PLACE CENTRAL HONG KONG,"5,000",0.00%
B01721,HUA NAN SECURITIES (HK) LTD,6/F KA WAH BANK CENTRE 232 DES VOEUX ROAD CENTRAL HONG KONG,"4,684",0.00%
B01745,EVERGREEN SECURITIES LTD,RM B-D 3/F SHING HING COMMERCIAL BUILDING 21-27 WING KUT STREET HONG KONG,"4,684",0.00%
B01937,CHANGJIANG SECURITIES BROKERAGE (HK) LTD,SUITE 1908 19/F COSCO TOWER 183 QUEEN'S ROAD CENTRAL HONG KONG,"4,684",0.00%
C00097,ABN AMRO BANK N.V.,LEVEL 70 INTERNATIONAL COMMERCE CENTRE 1 AUSTIN ROAD WEST KOWLOON,"4,474",0.00%
B01756,CHINA SKY SECURITIES LTD,RM 1106 11/F COSCO TOWER 183 QUEEN'S ROAD CENTRAL HONG KONG,"3,736",0.00%
B01943,PO SANG SECURITIES AND FUTURES LTD,1/F WING ON HOUSE 71 DES VOEUX ROAD CENTRAL HONG KONG,"3,736",0.00%
B01192,SATINU MARKETS LTD,26/F CHINA UNITED CENTRE 28 MARBLE ROAD NORTH POINT HONG KONG,"3,500",0.00%
,YU MAN TING *,FLAT 11D BLOCK 13 CITY GARDEN NORTH POINT HONG KONG,"3,420",0.00%
B01772,TENSANT SECURITIES LTD,RM 1103 11/F COSCO TOWER 183 QUEEN'S ROAD CENTRAL HONG KONG,"3,420",0.00%
B01375,TAI CHENG SECURITIES LTD,RM 1601-08 16/F NAN FUNG TOWER 88 CONNAUGHT ROAD CENTRAL CENTRAL HONG KONG,"3,236",0.00%
B01674,MUNSUN SECURITIES LTD,RM 7809 78/F THE CENTER 99 QUEEN'S ROAD CENTRAL HONG KONG,"3,052",0.00%
B01920,TIANDA SECURITIES LTD,SUITES 2401-2410 24/F CITIC TOWER 1 TIM MEI AVENUE CENTRAL HONG KONG,"3,052",0.00%
B01936,MIGHTY BROKERAGE (ASIA) LTD,UNIT 1205B TUNG NING BUILDING 249-253 DES VOEUX ROAD CENTRAL HONG KONG,"3,052",0.00%
,WONG JING YUNG *,RM 219 2/F POK YUE HOUSE POK HONG ESTATE SHATIN NEW TERRITORIES,"3,000",0.00%
B01857,SOUTH OCEAN SECURITIES LTD,"RM 2011,2015-2016 20/F TWO INTERNATIONAL FINANCE CENTRE 8 FINANCE STREET CENTRAL HONG KONG","3,000",0.00%
B01885,EASTMONEY INTERNATIONAL SECURITIES LTD,UNIT 3203 TOWER 1 ADMIRALTY CENTRE 18 HARCOURT ROAD ADMIRALTY HONG KONG,"3,000",0.00%
B01922,SUN SECURITIES LTD,RM 805-806 8/F FAR EAST CONSORTIUM BUILDING 121 DES VOEUX ROAD CENTRAL HONG KONG,"2,920",0.00%
B01725,GT CAPITAL LTD,SUITES 2508-2509 25/F HARBOUR CENTRE 25 HARBOUR ROAD WANCHAI HONG KONG,"2,784",0.00%
B01329,BLOOMYEARS LTD,RM A & B 3/F WINNER COMMERCIAL BUILDING 401-403 LOCKHART ROAD WANCHAI HONG KONG,"2,759",0.00%
B01869,SYNERWEALTH FINANCIAL LTD,UNIT A 7/F KING PALACE PLAZA 55 KING YIP STREET KWUN TONG KOWLOON,"2,684",0.00%
B01640,BEIJING SECURITIES LTD,25/F OCTA TOWER 8 LAM CHAK STREET KOWLOON BAY KOWLOON,"2,500",0.00%
B01921,GONG PING SECURITIES LTD,UNIT D 8/F TOWER B BILLION CENTRE 1 WANG KWONG ROAD KOWLOON BAY KOWLOON,"2,500",0.00%
B01988,KOALA SECURITIES LTD,UNITS 1301-1302 13/F EVERBRIGHT CENTRE 108 GLOUCESTER ROAD WANCHAI HONG KONG,"2,500",0.00%
B01489,GRAND CARTEL SECURITIES CO LTD,UNIT A 17/F KA WAH BANK CENTRE 232 DES VOEUX ROAD CENTRAL SHEUNG WAN HONG KONG,"2,368",0.00%
B01671,AEVITAS SECURITIES LTD,RM 1201 DAWNING HOUSE 145 CONNAUGHT ROAD CENTRAL HONG KONG,"2,368",0.00%
B01694,POWER SECURITIES CO LTD,RM 503 5/F WING ON HOUSE 71 DES VOEUX ROAD CENTRAL CENTRAL HONG KONG,"2,368",0.00%
B01571,KARFORD SECURITIES LTD,FLAT D 7/F MAN LOK BUILDING 89-93 BONHAM STRAND EAST HONG KONG,"2,052",0.00%
,LAU YIN HUNG *,FLAT 16C FU YUEN 39-49 WANCHAI ROAD WANCHAI HONG KONG,"2,000",0.00%
B01487,MAXSON SECURITIES LTD,FLAT 5B LLOYDS COMMERCIAL CENTRE 8 WING LOK STREET SHEUNG WAN HONG KONG,"2,000",0.00%
B01580,WIN WIND SECURITIES LTD,25/F CHINA UNITED CENTRE 28 MARBLE ROAD NORTH POINT HONG KONG,"2,000",0.00%
B01945,INTEGRITY SECURITIES LTD,UNIT 3 18/F YUE XIU BUILDING 160-174 LOCKHART ROAD WANCHAI HONG KONG,"2,000",0.00%
B01308,GREAT WALL SECURITIES LTD,17/F 148 ELECTRIC ROAD NORTH POINT HONG KONG,"1,684",0.00%
B01729,JOINCAP SECURITIES LTD,SUITE 606 LEVEL 6 ONE PACIFIC PLACE 88 QUEENSWAY ADMIRALTY HONG KONG,"1,684",0.00%
B01948,CAITONG INTERNATIONAL SECURITIES CO LTD,UNITS 2401-2403 24/F GRAND MILLENNIUM PLAZA 181 QUEEN'S ROAD CENTRAL HONG KONG,"1,684",0.00%
B01935,JTI SECURITIES LTD,RM 1101 11/F 88 GLOUCESTER ROAD WANCHAI HONG KONG,"1,552",0.00%
,TANG CHEUNG *,RM 1502 15/F BLOCK B YUK TAO HOUSE TUNG TAO COURT SHAU KI WAN HONG KONG,"1,500",0.00%
B01631,TAI UNITED SECURITIES LTD,UNIT 810 L8 CORE F CYBERPORT 3 100 CYBERPORT ROAD HONG KONG,"1,500",0.00%
B01823,ANGLO CHINESE SECURITIES LTD,40/F TWO EXCHANGE SQUARE 8 CONNAUGHT PLACE CENTRAL HONG KONG,"1,500",0.00%
B02049,PACIFIC INTERNATIONAL SECURITIES LTD,SUITE 1003 10/F SILVERCORD TOWER 1 30 CANTON ROAD TSIM SHA TSUI KOWLOON,"1,500",0.00%
B01627,CHINA INNOVATIVE FINANCE SECURITIES LTD,UNIT 1410 14/F CHINA RESOURCES BUILDING 26 HARBOUR ROAD WANCHAI HONG KONG,"1,368",0.00%
B01641,FULL WIN SECURITIES LTD,RM 1101 11/F YUE SHING COMMERCIAL BUILDING 15-16 QUEEN VICTORIA STREET CENTRAL HONG KONG,"1,368",0.00%
B01625,METRO CAPITAL SECURITIES LTD,UNIT 502 5/F VERTICAL SQ 28 HEUNG YIP ROAD WONG CHUK HANG HONG KONG,"1,184",0.00%
B01754,SINOFORTUNE SECURITIES LTD,16/F CMA BUILDING 64-66 CONNAUGHT ROAD CENTRAL HONG KONG,"1,184",0.00%
B01860,KVB KUNLUN SECURITIES (HK) LTD,SUITE 6801 68/F INTERNATIONAL COMMERCE CENTRE 1 AUSTIN ROAD WEST KOWLOON,"1,184",0.00%
B01624,CHINA GUARD INVESTMENTS LTD,UNIT 3510 35/F THE CENTER 99 QUEEN'S ROAD CENTRAL HONG KONG,"1,000",0.00%
B01785,PARTNERS CAPITAL SECURITIES LTD,RM 803B 8/F TOWER 1 ADMIRALTY CENTRE 18 HARCOURT ROAD HONG KONG,"1,000",0.00%
B01884,HONG KONG SECURITIES (INTERNATIONAL),SUITE 6705 67/F CENTRAL PLAZA 18 HARBOUR ROAD WANCHAI HONG KONG,"1,000",0.00%
B01891,GOLDENWAY INVESTMENTS (HK) LTD,28/F TOWER 2 THE GATEWAY HARBOUR CITY TSIMSHATSUI KOWLOON,"1,000",0.00%
B01971,HGNH INTERNATIONAL SECURITIES CO LTD,9/F & 16/F KA WAH BANK CENTRE 232 DES VOEUX ROAD CENTRAL HONG KONG,"1,000",0.00%
B02051,GRAND VIEW SECURITIES LTD,SUITE 6209 62/F THE CENTER 99 QUEEN'S ROAD CENTRAL HONG KONG,"1,000",0.00%
B01403,QUEST STOCKBROKERS (HK) LTD,5/F WING ON CHEONG BUILDING 5 WING LOK STREET SHEUNG WAN HONG KONG,752,0.00%
,CHEUNG YUEN YU *,FLAT B 32/F BLOCK 7 CHELSEA HEIGHTS TUEN MUN NEW TERRITORIES,684,0.00%
,MAN SAU HAN BECKY *,NO.15 SIXTH STREET SECTION B FAIRVIEW PARK YUEN LONG NEW TERRITORIES,684,0.00%
B01619,TUNG WUI SECURITIES CO LTD,ROOM 801-3 TUNG MING BLDG 40-42 DES VOEUX ROAD CENTRAL HONG KONG,684,0.00%
B01670,HING SHING SECURITIES LTD,RM 701 TOWER 1 ADMIRALTY CENTRE ADMIRALTY HONG KONG,684,0.00%
B01977,ZHONGCAI SECURITIES LTD,3/F ZHONGCAI CENTRE 131 QUEEN'S ROAD CENTRAL CENTRAL HONG KONG,684,0.00%
B01110,J.P. MORGAN BROKING (HONG KONG) LTD,48/F ONE ISLAND EAST 18 WESTLANDS ROAD ISLAND EAST HONG KONG,600,0.00%
,CHEUNG YEE LAINE *,FLAT A 6/F HARRISON COURT PHASE 4 9 MAN WAN ROAD HOMANTIN KOWLOON,500,0.00%
,CHUNG MAN CHIN *,FLAT A 8/F BLOCK 1 CASCADES 93 CHUNG HAU STREET HOMANTIN KOWLOON,500,0.00%
B01810,ASTRUM CAPITAL MANAGEMENT LTD,RM 2704 TOWER 1 ADMIRALTY CENTRE 18 HARCOURT ROAD ADMIRALTY HONG KONG,500,0.00%
B01821,CHINA FINANCE KAB LTD,30/F CHINACHEM CENTURY TOWER 178 GLOUCESTER ROAD WANCHAI HONG KONG,500,0.00%
B01824,INSTINET PACIFIC LTD,31/F TWO INTERNATIONAL FINANCE CENTRE 8 FINANCE STREET CENTRAL HONG KONG,500,0.00%
B01909,SHENG YUAN SECURITIES LTD,UNITS 4303-4305 TOWER 1 TIMES SQUARE 1 MATHESON STREET CAUSEWAY BAY HONG KONG,500,0.00%
B01974,ARISTO SECURITIES LTD,RM 101 1/F ON HONG COMMERCIAL BUILDING 145 HENNESSY ROAD WANCHAI HONG KONG,500,0.00%
B01978,FOUNDER SECURITIES (HONG KONG) LTD,SUITES 1710-1719 JARDINE HOUSE 1 CONNAUGHT PLACE CENTRAL HONG KONG,500,0.00%
B01986,HUAJIN SECURITIES (INTERNATIONAL) LTD,SUITE 1101 11/F CHAMPION TOWER 3 GARDEN ROAD CENTRAL HONG KONG,500,0.00%
B02008,AMTD GLOBAL MARKETS LTD,23/F-25/F NEXXUS BUILDING 41 CONNAUGHT ROAD CENTRAL CENTRAL HONG KONG,500,0.00%
B02022,CHAOSHANG SECURITIES LTD,RM 4001-4002 40/F CHINA RESOURCES BUILDING 26 HARBOUR ROAD WANCHAI HONG KONG,500,0.00%
B02044,FERRAN SECURITIES LTD,RM 1201 OTB BUILDING 259-265 DES VOEUX ROAD CENTRAL HONG KONG,500,0.00%
B02045,AAA SECURITIES CO. LTD,SUITE 6B 89 WING LOK STREET HONG KONG,500,0.00%
B01156,WING LUNG SECURITIES LTD,45/F CHAMPION TOWER 3 GARDEN ROAD CENTRAL HONG KONG,2,0.00%
